17:06:08.180410 IP 33df8a82-1620-4389-bcc8-991291832340.internal.cloudapp.net.49258 > 20.207.70.99.https: Flags [P.], seq 2724760117:2724760331, ack 2917640839, win 24275, options [nop,nop,TS val 1224541522 ecr 1885381356], length 214
17:06:08.180462 IP 33df8a82-1620-4389-bcc8-991291832340.internal.cloudapp.net.49258 > 20.207.70.99.https: Flags [P.], seq 214:544, ack 1, win 24275, options [nop,nop,TS val 1224541522 ecr 1885381356], length 330
17:06:08.180516 IP 33df8a82-1620-4389-bcc8-991291832340.internal.cloudapp.net.49258 > 20.207.70.99.https: Flags [P.], seq 544:660, ack 1, win 24275, options [nop,nop,TS val 1224541522 ecr 1885381356], length 116
17:06:08.181145 IP 20.207.70.99.https > 33df8a82-1620-4389-bcc8-991291832340.internal.cloudapp.net.49258: Flags [.], ack 214, win 19822, options [nop,nop,TS val 1885381402 ecr 1224541522], length 0
17:06:08.181185 IP 20.207.70.99.https > 33df8a82-1620-4389-bcc8-991291832340.internal.cloudapp.net.49258: Flags [.], ack 544, win 19822, options [nop,nop,TS val 1885381402 ecr 1224541522], length 0
17:06:08.181185 IP 20.207.70.99.https > 33df8a82-1620-4389-bcc8-991291832340.internal.cloudapp.net.49258: Flags [.], ack 660, win 19822, options [nop,nop,TS val 1885381402 ecr 1224541522], length 0
17:06:08.197143 IP 20.207.70.99.https > 33df8a82-1620-4389-bcc8-991291832340.internal.cloudapp.net.49258: Flags [P.], seq 1:291, ack 660, win 19822, options [nop,nop,TS val 1885381418 ecr 1224541522], length 290
17:06:08.199031 IP 33df8a82-1620-4389-bcc8-991291832340.internal.cloudapp.net.49258 > 20.207.70.99.https: Flags [P.], seq 660:776, ack 291, win 24275, options [nop,nop,TS val 1224541541 ecr 1885381418], length 116
17:06:08.199165 IP 33df8a82-1620-4389-bcc8-991291832340.internal.cloudapp.net.49258 > 20.207.70.99.https: Flags [P.], seq 776:892, ack 291, win 24275, options [nop,nop,TS val 1224541541 ecr 1885381418], length 116
17:06:08.199852 IP 20.207.70.99.https > 33df8a82-1620-4389-bcc8-991291832340.internal.cloudapp.net.49258: Flags [.], ack 892, win 19822, options [nop,nop,TS val 1885381421 ecr 1224541541], length 0
17:06:08.207020 IP 33df8a82-1620-4389-bcc8-991291832340.internal.cloudapp.net.48504 > 168.63.129.16.http: Flags [S], seq 2346278918, win 64240, options [mss 1460,sackOK,TS val 3055143810 ecr 0,nop,wscale 7], length 0
17:06:08.207309 IP 168.63.129.16.http > 33df8a82-1620-4389-bcc8-991291832340.internal.cloudapp.net.48504: Flags [S.], seq 4132315972, ack 2346278919, win 65535, options [mss 1460,nop,wscale 8,sackOK,TS val 3141996322 ecr 3055143810], length 0
17:06:08.207329 IP 33df8a82-1620-4389-bcc8-991291832340.internal.cloudapp.net.48504 > 168.63.129.16.http: Flags [.], ack 1, win 502, options [nop,nop,TS val 3055143810 ecr 3141996322], length 0
17:06:08.207351 IP 33df8a82-1620-4389-bcc8-991291832340.internal.cloudapp.net.48504 > 168.63.129.16.http: Flags [P.], seq 1:201, ack 1, win 502, options [nop,nop,TS val 3055143810 ecr 3141996322], length 200: HTTP: GET /machine/?comp=goalstate HTTP/1.1
17:06:08.208821 IP 168.63.129.16.http > 33df8a82-1620-4389-bcc8-991291832340.internal.cloudapp.net.48504: Flags [FP.], seq 1:2486, ack 201, win 16387, options [nop,nop,TS val 3141996323 ecr 3055143810], length 2485: HTTP: HTTP/1.1 200 OK
17:06:08.208850 IP 33df8a82-1620-4389-bcc8-991291832340.internal.cloudapp.net.48504 > 168.63.129.16.http: Flags [.], ack 2487, win 501, options [nop,nop,TS val 3055143812 ecr 3141996323], length 0
17:06:08.209018 IP 33df8a82-1620-4389-bcc8-991291832340.internal.cloudapp.net.48504 > 168.63.129.16.http: Flags [F.], seq 201, ack 2487, win 501, options [nop,nop,TS val 3055143812 ecr 3141996323], length 0
17:06:08.209371 IP 168.63.129.16.http > 33df8a82-1620-4389-bcc8-991291832340.internal.cloudapp.net.48504: Flags [.], ack 202, win 16387, options [nop,nop,TS val 3141996324 ecr 3055143812], length 0
17:06:08.209500 IP 33df8a82-1620-4389-bcc8-991291832340.internal.cloudapp.net.50430 > 168.63.129.16.32526: Flags [S], seq 1459077777, win 64240, options [mss 1460,sackOK,TS val 3055143812 ecr 0,nop,wscale 7], length 0
17:06:08.209723 IP 168.63.129.16.32526 > 33df8a82-1620-4389-bcc8-991291832340.internal.cloudapp.net.50430: Flags [S.], seq 2136734309, ack 1459077778, win 65535, options [mss 1460,nop,wscale 8,sackOK,TS val 3141996324 ecr 3055143812], length 0
17:06:08.209735 IP 33df8a82-1620-4389-bcc8-991291832340.internal.cloudapp.net.50430 > 168.63.129.16.32526: Flags [.], ack 1, win 502, options [nop,nop,TS val 3055143813 ecr 3141996324], length 0
17:06:08.209755 IP 33df8a82-1620-4389-bcc8-991291832340.internal.cloudapp.net.50430 > 168.63.129.16.32526: Flags [P.], seq 1:467, ack 1, win 502, options [nop,nop,TS val 3055143813 ecr 3141996324], length 466
17:06:08.214811 IP 168.63.129.16.32526 > 33df8a82-1620-4389-bcc8-991291832340.internal.cloudapp.net.50430: Flags [FP.], seq 1:146, ack 467, win 16386, options [nop,nop,TS val 3141996329 ecr 3055143813], length 145
17:06:08.214940 IP 33df8a82-1620-4389-bcc8-991291832340.internal.cloudapp.net.50430 > 168.63.129.16.32526: Flags [F.], seq 467, ack 147, win 501, options [nop,nop,TS val 3055143818 ecr 3141996329], length 0
17:06:08.215104 IP 168.63.129.16.32526 > 33df8a82-1620-4389-bcc8-991291832340.internal.cloudapp.net.50430: Flags [.], ack 468, win 16386, options [nop,nop,TS val 3141996330 ecr 3055143818], length 0
17:06:08.215698 IP 33df8a82-1620-4389-bcc8-991291832340.internal.cloudapp.net.50442 > 168.63.129.16.32526: Flags [S], seq 3701970517, win 64240, options [mss 1460,sackOK,TS val 3055143819 ecr 0,nop,wscale 7], length 0
17:06:08.215880 IP 168.63.129.16.32526 > 33df8a82-1620-4389-bcc8-991291832340.internal.cloudapp.net.50442: Flags [S.], seq 1866417264, ack 3701970518, win 65535, options [mss 1460,nop,wscale 8,sackOK,TS val 3141996331 ecr 3055143819], length 0
17:06:08.215896 IP 33df8a82-1620-4389-bcc8-991291832340.internal.cloudapp.net.50442 > 168.63.129.16.32526: Flags [.], ack 1, win 502, options [nop,nop,TS val 3055143819 ecr 3141996331], length 0
17:06:08.215919 IP 33df8a82-1620-4389-bcc8-991291832340.internal.cloudapp.net.50442 > 168.63.129.16.32526: Flags [P.], seq 1:414, ack 1, win 502, options [nop,nop,TS val 3055143819 ecr 3141996331], length 413
17:06:08.215932 IP 33df8a82-1620-4389-bcc8-991291832340.internal.cloudapp.net.50442 > 168.63.129.16.32526: Flags [P.], seq 414:1018, ack 1, win 502, options [nop,nop,TS val 3055143819 ecr 3141996331], length 604
17:06:08.216147 IP 168.63.129.16.32526 > 33df8a82-1620-4389-bcc8-991291832340.internal.cloudapp.net.50442: Flags [.], ack 1018, win 16384, options [nop,nop,TS val 3141996331 ecr 3055143819], length 0
17:06:08.216504 IP 168.63.129.16.32526 > 33df8a82-1620-4389-bcc8-991291832340.internal.cloudapp.net.50442: Flags [FP.], seq 1:155, ack 1018, win 16384, options [nop,nop,TS val 3141996331 ecr 3055143819], length 154
17:06:08.217013 IP 33df8a82-1620-4389-bcc8-991291832340.internal.cloudapp.net.50448 > 168.63.129.16.32526: Flags [S], seq 3091352632, win 64240, options [mss 1460,sackOK,TS val 3055143820 ecr 0,nop,wscale 7], length 0
17:06:08.217202 IP 168.63.129.16.32526 > 33df8a82-1620-4389-bcc8-991291832340.internal.cloudapp.net.50448: Flags [S.], seq 3237402233, ack 3091352633, win 65535, options [mss 1460,nop,wscale 8,sackOK,TS val 3141996332 ecr 3055143820], length 0
17:06:08.217222 IP 33df8a82-1620-4389-bcc8-991291832340.internal.cloudapp.net.50448 > 168.63.129.16.32526: Flags [.], ack 1, win 502, options [nop,nop,TS val 3055143820 ecr 3141996332], length 0
17:06:08.217245 IP 33df8a82-1620-4389-bcc8-991291832340.internal.cloudapp.net.50448 > 168.63.129.16.32526: Flags [P.], seq 1:416, ack 1, win 502, options [nop,nop,TS val 3055143820 ecr 3141996332], length 415
17:06:08.217262 IP 33df8a82-1620-4389-bcc8-991291832340.internal.cloudapp.net.50448 > 168.63.129.16.32526: Flags [P.], seq 416:7656, ack 1, win 502, options [nop,nop,TS val 3055143820 ecr 3141996332], length 7240
17:06:08.217268 IP 33df8a82-1620-4389-bcc8-991291832340.internal.cloudapp.net.50448 > 168.63.129.16.32526: Flags [P.], seq 7656:13448, ack 1, win 502, options [nop,nop,TS val 3055143820 ecr 3141996332], length 5792
17:06:08.217363 IP 168.63.129.16.32526 > 33df8a82-1620-4389-bcc8-991291832340.internal.cloudapp.net.50448: Flags [.], ack 13448, win 16388, options [nop,nop,TS val 3141996332 ecr 3055143820], length 0
17:06:08.217377 IP 33df8a82-1620-4389-bcc8-991291832340.internal.cloudapp.net.50448 > 168.63.129.16.32526: Flags [P.], seq 13448:15378, ack 1, win 502, options [nop,nop,TS val 3055143820 ecr 3141996332], length 1930
17:06:08.217504 IP 168.63.129.16.32526 > 33df8a82-1620-4389-bcc8-991291832340.internal.cloudapp.net.50448: Flags [.], ack 15378, win 16388, options [nop,nop,TS val 3141996332 ecr 3055143820], length 0
17:06:08.218480 IP 168.63.129.16.32526 > 33df8a82-1620-4389-bcc8-991291832340.internal.cloudapp.net.50448: Flags [FP.], seq 1:155, ack 15378, win 16388, options [nop,nop,TS val 3141996332 ecr 3055143820], length 154
17:06:08.218683 IP 33df8a82-1620-4389-bcc8-991291832340.internal.cloudapp.net.50442 > 168.63.129.16.32526: Flags [F.], seq 1018, ack 156, win 501, options [nop,nop,TS val 3055143822 ecr 3141996331], length 0
17:06:08.218711 IP 33df8a82-1620-4389-bcc8-991291832340.internal.cloudapp.net.50448 > 168.63.129.16.32526: Flags [F.], seq 15378, ack 156, win 501, options [nop,nop,TS val 3055143822 ecr 3141996332], length 0
17:06:08.218805 IP 168.63.129.16.32526 > 33df8a82-1620-4389-bcc8-991291832340.internal.cloudapp.net.50442: Flags [.], ack 1019, win 16384, options [nop,nop,TS val 3141996334 ecr 3055143822], length 0
17:06:08.218819 IP 168.63.129.16.32526 > 33df8a82-1620-4389-bcc8-991291832340.internal.cloudapp.net.50448: Flags [.], ack 15379, win 16388, options [nop,nop,TS val 3141996334 ecr 3055143822], length 0
17:06:08.249909 IP 33df8a82-1620-4389-bcc8-991291832340.internal.cloudapp.net.49258 > 20.207.70.99.https: Flags [P.], seq 892:1154, ack 291, win 24275, options [nop,nop,TS val 1224541592 ecr 1885381421], length 262
17:06:08.250111 IP 33df8a82-1620-4389-bcc8-991291832340.internal.cloudapp.net.49258 > 20.207.70.99.https: Flags [P.], seq 1154:1270, ack 291, win 24275, options [nop,nop,TS val 1224541592 ecr 1885381421], length 116
17:06:08.251056 IP 20.207.70.99.https > 33df8a82-1620-4389-bcc8-991291832340.internal.cloudapp.net.49258: Flags [.], ack 1270, win 19822, options [nop,nop,TS val 1885381472 ecr 1224541592], length 0
17:06:08.252966 IP 33df8a82-1620-4389-bcc8-991291832340.internal.cloudapp.net.49258 > 20.207.70.99.https: Flags [P.], seq 1270:1532, ack 291, win 24275, options [nop,nop,TS val 1224541595 ecr 1885381472], length 262
17:06:08.253103 IP 33df8a82-1620-4389-bcc8-991291832340.internal.cloudapp.net.49258 > 20.207.70.99.https: Flags [P.], seq 1532:1648, ack 291, win 24275, options [nop,nop,TS val 1224541595 ecr 1885381472], length 116
17:06:08.253805 IP 20.207.70.99.https > 33df8a82-1620-4389-bcc8-991291832340.internal.cloudapp.net.49258: Flags [.], ack 1648, win 19822, options [nop,nop,TS val 1885381475 ecr 1224541595], length 0
17:06:08.265980 IP 20.207.70.99.https > 33df8a82-1620-4389-bcc8-991291832340.internal.cloudapp.net.49258: Flags [P.], seq 291:645, ack 1648, win 19822, options [nop,nop,TS val 1885381487 ecr 1224541595], length 354
17:06:08.268273 IP 33df8a82-1620-4389-bcc8-991291832340.internal.cloudapp.net.49258 > 20.207.70.99.https: Flags [P.], seq 1648:1764, ack 645, win 24275, options [nop,nop,TS val 1224541610 ecr 1885381487], length 116
17:06:08.268389 IP 33df8a82-1620-4389-bcc8-991291832340.internal.cloudapp.net.49258 > 20.207.70.99.https: Flags [P.], seq 1764:1880, ack 645, win 24275, options [nop,nop,TS val 1224541610 ecr 1885381487], length 116
17:06:08.272994 IP 20.207.70.99.https > 33df8a82-1620-4389-bcc8-991291832340.internal.cloudapp.net.49258: Flags [.], ack 1880, win 19822, options [nop,nop,TS val 1885381490 ecr 1224541610], length 0
17:06:08.277528 IP 178.238.223.35.bc.googleusercontent.com.https > 33df8a82-1620-4389-bcc8-991291832340.internal.cloudapp.net.46218: Flags [.], ack 3892373554, win 163, options [nop,nop,TS val 3579029343 ecr 1042332975], length 0
17:06:08.373273 IP 178.238.223.35.bc.googleusercontent.com.https > 33df8a82-1620-4389-bcc8-991291832340.internal.cloudapp.net.46562: Flags [.], ack 3598427817, win 163, options [nop,nop,TS val 301680418 ecr 1042333088], length 0
17:06:08.557803 IP 20.207.70.99.https > 33df8a82-1620-4389-bcc8-991291832340.internal.cloudapp.net.49258: Flags [P.], seq 645:855, ack 1880, win 19822, options [nop,nop,TS val 1885381778 ecr 1224541610], length 210
17:06:08.559881 IP 33df8a82-1620-4389-bcc8-991291832340.internal.cloudapp.net.49258 > 20.207.70.99.https: Flags [P.], seq 1880:1980, ack 855, win 24275, options [nop,nop,TS val 1224541902 ecr 1885381778], length 100
17:06:08.559902 IP 33df8a82-1620-4389-bcc8-991291832340.internal.cloudapp.net.49258 > 20.207.70.99.https: Flags [P.], seq 1980:2096, ack 855, win 24275, options [nop,nop,TS val 1224541902 ecr 1885381778], length 116
17:06:08.560830 IP 20.207.70.99.https > 33df8a82-1620-4389-bcc8-991291832340.internal.cloudapp.net.49258: Flags [.], ack 2096, win 19822, options [nop,nop,TS val 1885381781 ecr 1224541902], length 0
17:06:08.937552 IP 33df8a82-1620-4389-bcc8-991291832340.internal.cloudapp.net.49258 > 20.207.70.99.https: Flags [P.], seq 2096:2196, ack 855, win 24275, options [nop,nop,TS val 1224542279 ecr 1885381781], length 100
17:06:08.937579 IP 33df8a82-1620-4389-bcc8-991291832340.internal.cloudapp.net.49258 > 20.207.70.99.https: Flags [P.], seq 2196:2312, ack 855, win 24275, options [nop,nop,TS val 1224542279 ecr 1885381781], length 116
17:06:08.938670 IP 20.207.70.99.https > 33df8a82-1620-4389-bcc8-991291832340.internal.cloudapp.net.49258: Flags [.], ack 2312, win 19822, options [nop,nop,TS val 1885382159 ecr 1224542279], length 0
17:06:09.167463 IP 33df8a82-1620-4389-bcc8-991291832340.internal.cloudapp.net.55850 > 20.150.114.101.https: Flags [P.], seq 3553861599:3553862103, ack 410135926, win 501, options [nop,nop,TS val 3175338978 ecr 1154137580], length 504
17:06:09.170177 IP 20.150.114.101.https > 33df8a82-1620-4389-bcc8-991291832340.internal.cloudapp.net.55850: Flags [P.], seq 1:367, ack 504, win 16382, options [nop,nop,TS val 1154138582 ecr 3175338978], length 366
17:06:09.170177 IP 20.150.114.101.https > 33df8a82-1620-4389-bcc8-991291832340.internal.cloudapp.net.55850: Flags [P.], seq 367:394, ack 504, win 16382, options [nop,nop,TS val 1154138582 ecr 3175338978], length 27
17:06:09.170195 IP 33df8a82-1620-4389-bcc8-991291832340.internal.cloudapp.net.55850 > 20.150.114.101.https: Flags [.], ack 367, win 501, options [nop,nop,TS val 3175338981 ecr 1154138582], length 0
17:06:09.170201 IP 33df8a82-1620-4389-bcc8-991291832340.internal.cloudapp.net.55850 > 20.150.114.101.https: Flags [.], ack 394, win 501, options [nop,nop,TS val 3175338981 ecr 1154138582], length 0
17:06:09.256363 IP 33df8a82-1620-4389-bcc8-991291832340.internal.cloudapp.net.49258 > 20.207.70.99.https: Flags [P.], seq 2312:2574, ack 855, win 24275, options [nop,nop,TS val 1224542598 ecr 1885382159], length 262
17:06:09.256499 IP 33df8a82-1620-4389-bcc8-991291832340.internal.cloudapp.net.49258 > 20.207.70.99.https: Flags [P.], seq 2574:2690, ack 855, win 24275, options [nop,nop,TS val 1224542598 ecr 1885382159], length 116
17:06:09.256990 IP 33df8a82-1620-4389-bcc8-991291832340.internal.cloudapp.net.49258 > 20.207.70.99.https: Flags [P.], seq 2690:2952, ack 855, win 24275, options [nop,nop,TS val 1224542599 ecr 1885382159], length 262
17:06:09.257072 IP 33df8a82-1620-4389-bcc8-991291832340.internal.cloudapp.net.49258 > 20.207.70.99.https: Flags [P.], seq 2952:3068, ack 855, win 24275, options [nop,nop,TS val 1224542599 ecr 1885382159], length 116
17:06:09.257238 IP 20.207.70.99.https > 33df8a82-1620-4389-bcc8-991291832340.internal.cloudapp.net.49258: Flags [.], ack 2690, win 19822, options [nop,nop,TS val 1885382478 ecr 1224542598], length 0
17:06:09.257776 IP 20.207.70.99.https > 33df8a82-1620-4389-bcc8-991291832340.internal.cloudapp.net.49258: Flags [.], ack 3068, win 19822, options [nop,nop,TS val 1885382479 ecr 1224542599], length 0
17:06:09.266647 IP 20.207.70.99.https > 33df8a82-1620-4389-bcc8-991291832340.internal.cloudapp.net.49258: Flags [P.], seq 855:1209, ack 3068, win 19822, options [nop,nop,TS val 1885382487 ecr 1224542599], length 354
17:06:09.268540 IP 33df8a82-1620-4389-bcc8-991291832340.internal.cloudapp.net.49258 > 20.207.70.99.https: Flags [P.], seq 3068:3184, ack 1209, win 24275, options [nop,nop,TS val 1224542610 ecr 1885382487], length 116
17:06:09.268763 IP 33df8a82-1620-4389-bcc8-991291832340.internal.cloudapp.net.49258 > 20.207.70.99.https: Flags [P.], seq 3184:3300, ack 1209, win 24275, options [nop,nop,TS val 1224542611 ecr 1885382487], length 116
17:06:09.269506 IP 20.207.70.99.https > 33df8a82-1620-4389-bcc8-991291832340.internal.cloudapp.net.49258: Flags [.], ack 3300, win 19822, options [nop,nop,TS val 1885382490 ecr 1224542610], length 0
17:06:09.466660 IP 33df8a82-1620-4389-bcc8-991291832340.internal.cloudapp.net.45964 > 178.238.223.35.bc.googleusercontent.com.https: Flags [.], ack 421972051, win 501, options [nop,nop,TS val 1042349422 ecr 3435420737], length 0
17:06:09.594672 IP 33df8a82-1620-4389-bcc8-991291832340.internal.cloudapp.net.46232 > 178.238.223.35.bc.googleusercontent.com.https: Flags [.], ack 645199978, win 501, options [nop,nop,TS val 1042349550 ecr 1291504406], length 0
17:06:09.653383 IP 33df8a82-1620-4389-bcc8-991291832340.internal.cloudapp.net.49258 > 20.207.70.99.https: Flags [P.], seq 3300:3626, ack 1209, win 24275, options [nop,nop,TS val 1224542995 ecr 1885382490], length 326
17:06:09.653528 IP 33df8a82-1620-4389-bcc8-991291832340.internal.cloudapp.net.49258 > 20.207.70.99.https: Flags [P.], seq 3626:3742, ack 1209, win 24275, options [nop,nop,TS val 1224542995 ecr 1885382490], length 116
17:06:09.654295 IP 20.207.70.99.https > 33df8a82-1620-4389-bcc8-991291832340.internal.cloudapp.net.49258: Flags [.], ack 3742, win 19822, options [nop,nop,TS val 1885382875 ecr 1224542995], length 0
17:06:09.661894 IP 20.207.70.99.https > 33df8a82-1620-4389-bcc8-991291832340.internal.cloudapp.net.49258: Flags [P.], seq 1209:1403, ack 3742, win 19822, options [nop,nop,TS val 1885382883 ecr 1224542995], length 194
17:06:09.698092 IP 178.238.223.35.bc.googleusercontent.com.https > 33df8a82-1620-4389-bcc8-991291832340.internal.cloudapp.net.45964: Flags [.], ack 1, win 163, options [nop,nop,TS val 3435435970 ecr 1042319146], length 0
17:06:09.702656 IP 33df8a82-1620-4389-bcc8-991291832340.internal.cloudapp.net.49258 > 20.207.70.99.https: Flags [.], ack 1403, win 24275, options [nop,nop,TS val 1224543045 ecr 1885382883], length 0
17:06:09.813577 IP 178.238.223.35.bc.googleusercontent.com.https > 33df8a82-1620-4389-bcc8-991291832340.internal.cloudapp.net.46232: Flags [.], ack 1, win 163, options [nop,nop,TS val 1291519645 ecr 1042334530], length 0
17:06:10.030823 IP 20.207.70.99.https > 33df8a82-1620-4389-bcc8-991291832340.internal.cloudapp.net.49258: Flags [P.], seq 1403:1613, ack 3742, win 19822, options [nop,nop,TS val 1885383251 ecr 1224543045], length 210
17:06:10.030850 IP 33df8a82-1620-4389-bcc8-991291832340.internal.cloudapp.net.49258 > 20.207.70.99.https: Flags [.], ack 1613, win 24275, options [nop,nop,TS val 1224543373 ecr 1885383251], length 0
17:06:10.033045 IP 33df8a82-1620-4389-bcc8-991291832340.internal.cloudapp.net.49258 > 20.207.70.99.https: Flags [P.], seq 3742:3874, ack 1613, win 24275, options [nop,nop,TS val 1224543375 ecr 1885383251], length 132
17:06:10.033129 IP 33df8a82-1620-4389-bcc8-991291832340.internal.cloudapp.net.49258 > 20.207.70.99.https: Flags [P.], seq 3874:3990, ack 1613, win 24275, options [nop,nop,TS val 1224543375 ecr 1885383251], length 116
17:06:10.034754 IP 20.207.70.99.https > 33df8a82-1620-4389-bcc8-991291832340.internal.cloudapp.net.49258: Flags [.], ack 3990, win 19822, options [nop,nop,TS val 1885383255 ecr 1224543375], length 0
17:06:10.106657 IP 33df8a82-1620-4389-bcc8-991291832340.internal.cloudapp.net.43936 > 178.238.223.35.bc.googleusercontent.com.https: Flags [.], ack 2908960060, win 501, options [nop,nop,TS val 1042350062 ecr 2749961591], length 0
17:06:10.170186 IP 33df8a82-1620-4389-bcc8-991291832340.internal.cloudapp.net.55850 > 20.150.114.101.https: Flags [P.], seq 504:1008, ack 394, win 501, options [nop,nop,TS val 3175339981 ecr 1154138582], length 504
17:06:10.172663 IP 20.150.114.101.https > 33df8a82-1620-4389-bcc8-991291832340.internal.cloudapp.net.55850: Flags [P.], seq 394:760, ack 1008, win 16380, options [nop,nop,TS val 1154139584 ecr 3175339981], length 366
17:06:10.172663 IP 20.150.114.101.https > 33df8a82-1620-4389-bcc8-991291832340.internal.cloudapp.net.55850: Flags [P.], seq 760:787, ack 1008, win 16380, options [nop,nop,TS val 1154139584 ecr 3175339981], length 27
17:06:10.172691 IP 33df8a82-1620-4389-bcc8-991291832340.internal.cloudapp.net.55850 > 20.150.114.101.https: Flags [.], ack 760, win 501, options [nop,nop,TS val 3175339984 ecr 1154139584], length 0
17:06:10.172699 IP 33df8a82-1620-4389-bcc8-991291832340.internal.cloudapp.net.55850 > 20.150.114.101.https: Flags [.], ack 787, win 501, options [nop,nop,TS val 3175339984 ecr 1154139584], length 0
17:06:10.226660 IP 33df8a82-1620-4389-bcc8-991291832340.internal.cloudapp.net.58858 > 178.238.223.35.bc.googleusercontent.com.https: Flags [.], ack 41883205, win 501, options [nop,nop,TS val 1042350182 ecr 1583098813], length 0
17:06:10.257422 IP 33df8a82-1620-4389-bcc8-991291832340.internal.cloudapp.net.49258 > 20.207.70.99.https: Flags [P.], seq 3990:4236, ack 1613, win 24275, options [nop,nop,TS val 1224543599 ecr 1885383255], length 246
17:06:10.257656 IP 33df8a82-1620-4389-bcc8-991291832340.internal.cloudapp.net.49258 > 20.207.70.99.https: Flags [P.], seq 4236:4352, ack 1613, win 24275, options [nop,nop,TS val 1224543600 ecr 1885383255], length 116
17:06:10.258402 IP 20.207.70.99.https > 33df8a82-1620-4389-bcc8-991291832340.internal.cloudapp.net.49258: Flags [.], ack 4352, win 19822, options [nop,nop,TS val 1885383479 ecr 1224543599], length 0
17:06:10.280386 IP 33df8a82-1620-4389-bcc8-991291832340.internal.cloudapp.net.49258 > 20.207.70.99.https: Flags [P.], seq 4352:4614, ack 1613, win 24275, options [nop,nop,TS val 1224543622 ecr 1885383479], length 262
17:06:10.280482 IP 33df8a82-1620-4389-bcc8-991291832340.internal.cloudapp.net.49258 > 20.207.70.99.https: Flags [P.], seq 4614:4730, ack 1613, win 24275, options [nop,nop,TS val 1224543622 ecr 1885383479], length 116
17:06:10.280576 IP 33df8a82-1620-4389-bcc8-991291832340.internal.cloudapp.net.49258 > 20.207.70.99.https: Flags [P.], seq 4730:4992, ack 1613, win 24275, options [nop,nop,TS val 1224543622 ecr 1885383479], length 262
17:06:10.280904 IP 33df8a82-1620-4389-bcc8-991291832340.internal.cloudapp.net.49258 > 20.207.70.99.https: Flags [P.], seq 4992:5108, ack 1613, win 24275, options [nop,nop,TS val 1224543623 ecr 1885383479], length 116
17:06:10.281717 IP 20.207.70.99.https > 33df8a82-1620-4389-bcc8-991291832340.internal.cloudapp.net.49258: Flags [.], ack 4992, win 19822, options [nop,nop,TS val 1885383502 ecr 1224543622], length 0
17:06:10.290251 IP 20.207.70.99.https > 33df8a82-1620-4389-bcc8-991291832340.internal.cloudapp.net.49258: Flags [P.], seq 1613:1967, ack 5108, win 19822, options [nop,nop,TS val 1885383511 ecr 1224543623], length 354
17:06:10.292191 IP 33df8a82-1620-4389-bcc8-991291832340.internal.cloudapp.net.49258 > 20.207.70.99.https: Flags [P.], seq 5108:5224, ack 1967, win 24275, options [nop,nop,TS val 1224543634 ecr 1885383511], length 116
17:06:10.292273 IP 33df8a82-1620-4389-bcc8-991291832340.internal.cloudapp.net.49258 > 20.207.70.99.https: Flags [P.], seq 5224:5340, ack 1967, win 24275, options [nop,nop,TS val 1224543634 ecr 1885383511], length 116
17:06:10.293032 IP 20.207.70.99.https > 33df8a82-1620-4389-bcc8-991291832340.internal.cloudapp.net.49258: Flags [.], ack 5340, win 19822, options [nop,nop,TS val 1885383514 ecr 1224543634], length 0
17:06:10.328752 IP 178.238.223.35.bc.googleusercontent.com.https > 33df8a82-1620-4389-bcc8-991291832340.internal.cloudapp.net.43936: Flags [.], ack 1, win 163, options [nop,nop,TS val 2749976832 ecr 1042304519], length 0
17:06:10.449224 IP 178.238.223.35.bc.googleusercontent.com.https > 33df8a82-1620-4389-bcc8-991291832340.internal.cloudapp.net.58858: Flags [.], ack 1, win 163, options [nop,nop,TS val 1583114038 ecr 1042319779], length 0
17:06:10.633820 IP 33df8a82-1620-4389-bcc8-991291832340.internal.cloudapp.net.51249 > 168.63.129.16.domain: 52277+ [1au] A? unleash.codeium.com. (48)
17:06:10.633999 IP 33df8a82-1620-4389-bcc8-991291832340.internal.cloudapp.net.53509 > 168.63.129.16.domain: 41556+ [1au] AAAA? unleash.codeium.com. (48)
17:06:10.634035 IP 33df8a82-1620-4389-bcc8-991291832340.internal.cloudapp.net.40756 > 168.63.129.16.domain: 12172+ [1au] AAAA? unleash.codeium.com. (48)
17:06:10.634792 IP 168.63.129.16.domain > 33df8a82-1620-4389-bcc8-991291832340.internal.cloudapp.net.40756: 12172 0/1/1 (138)
17:06:10.634979 IP 33df8a82-1620-4389-bcc8-991291832340.internal.cloudapp.net.58548 > 178.238.223.35.bc.googleusercontent.com.https: Flags [S], seq 4154290411, win 64240, options [mss 1460,sackOK,TS val 1042350590 ecr 0,nop,wscale 7], length 0
17:06:10.635590 IP 168.63.129.16.domain > 33df8a82-1620-4389-bcc8-991291832340.internal.cloudapp.net.51249: 52277 1/0/1 A 35.223.238.178 (64)
17:06:10.635673 IP 168.63.129.16.domain > 33df8a82-1620-4389-bcc8-991291832340.internal.cloudapp.net.53509: 41556 0/1/1 (138)
17:06:10.853993 IP 178.238.223.35.bc.googleusercontent.com.https > 33df8a82-1620-4389-bcc8-991291832340.internal.cloudapp.net.58548: Flags [S.], seq 2349487900, ack 4154290412, win 21120, options [mss 1420,sackOK,TS val 3560064212 ecr 1042350590,nop,wscale 7], length 0
17:06:10.854026 IP 33df8a82-1620-4389-bcc8-991291832340.internal.cloudapp.net.58548 > 178.238.223.35.bc.googleusercontent.com.https: Flags [.], ack 1, win 502, options [nop,nop,TS val 1042350809 ecr 3560064212], length 0
17:06:10.854319 IP 33df8a82-1620-4389-bcc8-991291832340.internal.cloudapp.net.58548 > 178.238.223.35.bc.googleusercontent.com.https: Flags [P.], seq 1:473, ack 1, win 502, options [nop,nop,TS val 1042350809 ecr 3560064212], length 472
17:06:10.986890 IP 20.207.70.99.https > 33df8a82-1620-4389-bcc8-991291832340.internal.cloudapp.net.49258: Flags [P.], seq 1967:2209, ack 5340, win 19822, options [nop,nop,TS val 1885384208 ecr 1224543634], length 242
17:06:10.987002 IP 20.207.70.99.https > 33df8a82-1620-4389-bcc8-991291832340.internal.cloudapp.net.49258: Flags [P.], seq 2209:4083, ack 5340, win 19822, options [nop,nop,TS val 1885384208 ecr 1224543634], length 1874
17:06:10.987045 IP 33df8a82-1620-4389-bcc8-991291832340.internal.cloudapp.net.49258 > 20.207.70.99.https: Flags [.], ack 4083, win 24275, options [nop,nop,TS val 1224544329 ecr 1885384208], length 0
17:06:10.988881 IP 33df8a82-1620-4389-bcc8-991291832340.internal.cloudapp.net.49258 > 20.207.70.99.https: Flags [P.], seq 5340:5456, ack 4083, win 24275, options [nop,nop,TS val 1224544331 ecr 1885384208], length 116
17:06:10.988950 IP 33df8a82-1620-4389-bcc8-991291832340.internal.cloudapp.net.49258 > 20.207.70.99.https: Flags [P.], seq 5456:5572, ack 4083, win 24275, options [nop,nop,TS val 1224544331 ecr 1885384208], length 116
17:06:10.989228 IP 33df8a82-1620-4389-bcc8-991291832340.internal.cloudapp.net.49258 > 20.207.70.99.https: Flags [P.], seq 5572:5770, ack 4083, win 24275, options [nop,nop,TS val 1224544331 ecr 1885384208], length 198
17:06:10.989423 IP 33df8a82-1620-4389-bcc8-991291832340.internal.cloudapp.net.49258 > 20.207.70.99.https: Flags [P.], seq 5770:5886, ack 4083, win 24275, options [nop,nop,TS val 1224544331 ecr 1885384208], length 116
17:06:10.989657 IP 20.207.70.99.https > 33df8a82-1620-4389-bcc8-991291832340.internal.cloudapp.net.49258: Flags [.], ack 5572, win 19822, options [nop,nop,TS val 1885384210 ecr 1224544331], length 0
17:06:10.990057 IP 20.207.70.99.https > 33df8a82-1620-4389-bcc8-991291832340.internal.cloudapp.net.49258: Flags [.], ack 5886, win 19822, options [nop,nop,TS val 1885384211 ecr 1224544331], length 0
17:06:10.990156 IP 33df8a82-1620-4389-bcc8-991291832340.internal.cloudapp.net.41722 > 178.238.223.35.bc.googleusercontent.com.https: Flags [P.], seq 2721443280:2721443598, ack 1788332949, win 501, options [nop,nop,TS val 1042350945 ecr 2239715243], length 318
17:06:10.990178 IP 33df8a82-1620-4389-bcc8-991291832340.internal.cloudapp.net.41722 > 178.238.223.35.bc.googleusercontent.com.https: Flags [P.], seq 318:1506, ack 1, win 501, options [nop,nop,TS val 1042350945 ecr 2239715243], length 1188
17:06:10.998309 IP 20.207.70.99.https > 33df8a82-1620-4389-bcc8-991291832340.internal.cloudapp.net.49258: Flags [P.], seq 4083:4549, ack 5886, win 19822, options [nop,nop,TS val 1885384219 ecr 1224544331], length 466
17:06:11.000015 IP 33df8a82-1620-4389-bcc8-991291832340.internal.cloudapp.net.49258 > 20.207.70.99.https: Flags [P.], seq 5886:6034, ack 4549, win 24275, options [nop,nop,TS val 1224544342 ecr 1885384219], length 148
17:06:11.000100 IP 33df8a82-1620-4389-bcc8-991291832340.internal.cloudapp.net.49258 > 20.207.70.99.https: Flags [P.], seq 6034:6150, ack 4549, win 24275, options [nop,nop,TS val 1224544342 ecr 1885384219], length 116
17:06:11.000831 IP 20.207.70.99.https > 33df8a82-1620-4389-bcc8-991291832340.internal.cloudapp.net.49258: Flags [.], ack 6150, win 19822, options [nop,nop,TS val 1885384222 ecr 1224544342], length 0
17:06:11.020268 IP 20.207.70.99.https > 33df8a82-1620-4389-bcc8-991291832340.internal.cloudapp.net.49258: Flags [P.], seq 4549:7463, ack 6150, win 19822, options [nop,nop,TS val 1885384241 ecr 1224544342], length 2914
17:06:11.020335 IP 33df8a82-1620-4389-bcc8-991291832340.internal.cloudapp.net.49258 > 20.207.70.99.https: Flags [.], ack 7463, win 24275, options [nop,nop,TS val 1224544362 ecr 1885384241], length 0
17:06:11.022271 IP 33df8a82-1620-4389-bcc8-991291832340.internal.cloudapp.net.49258 > 20.207.70.99.https: Flags [P.], seq 6150:6444, ack 7463, win 24275, options [nop,nop,TS val 1224544364 ecr 1885384241], length 294
17:06:11.022462 IP 33df8a82-1620-4389-bcc8-991291832340.internal.cloudapp.net.49258 > 20.207.70.99.https: Flags [P.], seq 6444:6560, ack 7463, win 24275, options [nop,nop,TS val 1224544364 ecr 1885384241], length 116
17:06:11.023290 IP 20.207.70.99.https > 33df8a82-1620-4389-bcc8-991291832340.internal.cloudapp.net.49258: Flags [.], ack 6560, win 19822, options [nop,nop,TS val 1885384244 ecr 1224544364], length 0
17:06:11.073217 IP 178.238.223.35.bc.googleusercontent.com.https > 33df8a82-1620-4389-bcc8-991291832340.internal.cloudapp.net.58548: Flags [.], ack 473, win 163, options [nop,nop,TS val 3560064432 ecr 1042350809], length 0
17:06:11.075175 IP 178.238.223.35.bc.googleusercontent.com.https > 33df8a82-1620-4389-bcc8-991291832340.internal.cloudapp.net.58548: Flags [P.], seq 1:2817, ack 473, win 163, options [nop,nop,TS val 3560064434 ecr 1042350809], length 2816
17:06:11.075175 IP 178.238.223.35.bc.googleusercontent.com.https > 33df8a82-1620-4389-bcc8-991291832340.internal.cloudapp.net.58548: Flags [P.], seq 2817:3129, ack 473, win 163, options [nop,nop,TS val 3560064434 ecr 1042350809], length 312
17:06:11.075188 IP 33df8a82-1620-4389-bcc8-991291832340.internal.cloudapp.net.58548 > 178.238.223.35.bc.googleusercontent.com.https: Flags [.], ack 2817, win 496, options [nop,nop,TS val 1042351030 ecr 3560064434], length 0
17:06:11.075194 IP 33df8a82-1620-4389-bcc8-991291832340.internal.cloudapp.net.58548 > 178.238.223.35.bc.googleusercontent.com.https: Flags [.], ack 3129, win 494, options [nop,nop,TS val 1042351030 ecr 3560064434], length 0
17:06:11.076868 IP 33df8a82-1620-4389-bcc8-991291832340.internal.cloudapp.net.58548 > 178.238.223.35.bc.googleusercontent.com.https: Flags [P.], seq 473:1660, ack 3129, win 501, options [nop,nop,TS val 1042351032 ecr 3560064434], length 1187
17:06:11.172878 IP 33df8a82-1620-4389-bcc8-991291832340.internal.cloudapp.net.55850 > 20.150.114.101.https: Flags [P.], seq 1008:1512, ack 787, win 501, options [nop,nop,TS val 3175340984 ecr 1154139584], length 504
17:06:11.175832 IP 20.150.114.101.https > 33df8a82-1620-4389-bcc8-991291832340.internal.cloudapp.net.55850: Flags [P.], seq 787:1153, ack 1512, win 16384, options [nop,nop,TS val 1154140588 ecr 3175340984], length 366
17:06:11.175851 IP 33df8a82-1620-4389-bcc8-991291832340.internal.cloudapp.net.55850 > 20.150.114.101.https: Flags [.], ack 1153, win 501, options [nop,nop,TS val 3175340987 ecr 1154140588], length 0
17:06:11.175858 IP 20.150.114.101.https > 33df8a82-1620-4389-bcc8-991291832340.internal.cloudapp.net.55850: Flags [P.], seq 1153:1180, ack 1512, win 16384, options [nop,nop,TS val 1154140588 ecr 3175340984], length 27
17:06:11.175866 IP 33df8a82-1620-4389-bcc8-991291832340.internal.cloudapp.net.55850 > 20.150.114.101.https: Flags [.], ack 1180, win 501, options [nop,nop,TS val 3175340987 ecr 1154140588], length 0
17:06:11.209807 IP 178.238.223.35.bc.googleusercontent.com.https > 33df8a82-1620-4389-bcc8-991291832340.internal.cloudapp.net.41722: Flags [.], ack 1506, win 163, options [nop,nop,TS val 2239728649 ecr 1042350945], length 0
17:06:11.210816 IP 178.238.223.35.bc.googleusercontent.com.https > 33df8a82-1620-4389-bcc8-991291832340.internal.cloudapp.net.41722: Flags [P.], seq 1:304, ack 1506, win 163, options [nop,nop,TS val 2239728651 ecr 1042350945], length 303
17:06:11.210827 IP 33df8a82-1620-4389-bcc8-991291832340.internal.cloudapp.net.41722 > 178.238.223.35.bc.googleusercontent.com.https: Flags [.], ack 304, win 501, options [nop,nop,TS val 1042351166 ecr 2239728651], length 0
17:06:11.295890 IP 178.238.223.35.bc.googleusercontent.com.https > 33df8a82-1620-4389-bcc8-991291832340.internal.cloudapp.net.58548: Flags [P.], seq 3129:3208, ack 1660, win 163, options [nop,nop,TS val 3560064655 ecr 1042351032], length 79
17:06:11.295908 IP 178.238.223.35.bc.googleusercontent.com.https > 33df8a82-1620-4389-bcc8-991291832340.internal.cloudapp.net.58548: Flags [P.], seq 3208:3287, ack 1660, win 163, options [nop,nop,TS val 3560064655 ecr 1042351032], length 79
17:06:11.295927 IP 33df8a82-1620-4389-bcc8-991291832340.internal.cloudapp.net.58548 > 178.238.223.35.bc.googleusercontent.com.https: Flags [.], ack 3287, win 501, options [nop,nop,TS val 1042351251 ecr 3560064655], length 0
17:06:11.296180 IP 178.238.223.35.bc.googleusercontent.com.https > 33df8a82-1620-4389-bcc8-991291832340.internal.cloudapp.net.58548: Flags [P.], seq 3287:3550, ack 1660, win 163, options [nop,nop,TS val 3560064655 ecr 1042351032], length 263
17:06:11.296196 IP 178.238.223.35.bc.googleusercontent.com.https > 33df8a82-1620-4389-bcc8-991291832340.internal.cloudapp.net.58548: Flags [P.], seq 3550:3574, ack 1660, win 163, options [nop,nop,TS val 3560064655 ecr 1042351032], length 24
17:06:11.296196 IP 178.238.223.35.bc.googleusercontent.com.https > 33df8a82-1620-4389-bcc8-991291832340.internal.cloudapp.net.58548: Flags [F.], seq 3574, ack 1660, win 163, options [nop,nop,TS val 3560064655 ecr 1042351032], length 0
17:06:11.296210 IP 33df8a82-1620-4389-bcc8-991291832340.internal.cloudapp.net.58548 > 178.238.223.35.bc.googleusercontent.com.https: Flags [.], ack 3574, win 501, options [nop,nop,TS val 1042351251 ecr 3560064655], length 0
17:06:11.296512 IP 33df8a82-1620-4389-bcc8-991291832340.internal.cloudapp.net.58548 > 178.238.223.35.bc.googleusercontent.com.https: Flags [P.], seq 1660:1684, ack 3575, win 501, options [nop,nop,TS val 1042351251 ecr 3560064655], length 24
17:06:11.296816 IP 33df8a82-1620-4389-bcc8-991291832340.internal.cloudapp.net.58548 > 178.238.223.35.bc.googleusercontent.com.https: Flags [F.], seq 1684, ack 3575, win 501, options [nop,nop,TS val 1042351252 ecr 3560064655], length 0
17:06:11.304169 IP 33df8a82-1620-4389-bcc8-991291832340.internal.cloudapp.net.49258 > 20.207.70.99.https: Flags [P.], seq 6560:6822, ack 7463, win 24275, options [nop,nop,TS val 1224544646 ecr 1885384244], length 262
17:06:11.304344 IP 33df8a82-1620-4389-bcc8-991291832340.internal.cloudapp.net.49258 > 20.207.70.99.https: Flags [P.], seq 6822:7200, ack 7463, win 24275, options [nop,nop,TS val 1224544646 ecr 1885384244], length 378
17:06:11.304396 IP 33df8a82-1620-4389-bcc8-991291832340.internal.cloudapp.net.49258 > 20.207.70.99.https: Flags [P.], seq 7200:7316, ack 7463, win 24275, options [nop,nop,TS val 1224544646 ecr 1885384244], length 116
17:06:11.305049 IP 20.207.70.99.https > 33df8a82-1620-4389-bcc8-991291832340.internal.cloudapp.net.49258: Flags [.], ack 7200, win 19822, options [nop,nop,TS val 1885384526 ecr 1224544646], length 0
17:06:11.314899 IP 20.207.70.99.https > 33df8a82-1620-4389-bcc8-991291832340.internal.cloudapp.net.49258: Flags [P.], seq 7463:7817, ack 7316, win 19822, options [nop,nop,TS val 1885384536 ecr 1224544646], length 354
17:06:11.316879 IP 33df8a82-1620-4389-bcc8-991291832340.internal.cloudapp.net.49258 > 20.207.70.99.https: Flags [P.], seq 7316:7432, ack 7817, win 24275, options [nop,nop,TS val 1224544659 ecr 1885384536], length 116
17:06:11.317058 IP 33df8a82-1620-4389-bcc8-991291832340.internal.cloudapp.net.49258 > 20.207.70.99.https: Flags [P.], seq 7432:7548, ack 7817, win 24275, options [nop,nop,TS val 1224544659 ecr 1885384536], length 116
17:06:11.317839 IP 20.207.70.99.https > 33df8a82-1620-4389-bcc8-991291832340.internal.cloudapp.net.49258: Flags [.], ack 7548, win 19822, options [nop,nop,TS val 1885384539 ecr 1224544659], length 0
17:06:11.405855 IP 33df8a82-1620-4389-bcc8-991291832340.internal.cloudapp.net.49258 > 20.207.70.99.https: Flags [P.], seq 7548:7648, ack 7817, win 24275, options [nop,nop,TS val 1224544748 ecr 1885384539], length 100
17:06:11.405886 IP 33df8a82-1620-4389-bcc8-991291832340.internal.cloudapp.net.49258 > 20.207.70.99.https: Flags [P.], seq 7648:7764, ack 7817, win 24275, options [nop,nop,TS val 1224544748 ecr 1885384539], length 116
17:06:11.406844 IP 20.207.70.99.https > 33df8a82-1620-4389-bcc8-991291832340.internal.cloudapp.net.49258: Flags [.], ack 7764, win 19822, options [nop,nop,TS val 1885384628 ecr 1224544748], length 0
17:06:11.418575 IP 20.207.70.99.https > 33df8a82-1620-4389-bcc8-991291832340.internal.cloudapp.net.49258: Flags [P.], seq 7817:7979, ack 7764, win 19822, options [nop,nop,TS val 1885384639 ecr 1224544748], length 162
17:06:11.458662 IP 33df8a82-1620-4389-bcc8-991291832340.internal.cloudapp.net.49258 > 20.207.70.99.https: Flags [.], ack 7979, win 24275, options [nop,nop,TS val 1224544801 ecr 1885384639], length 0
17:06:11.516141 IP 178.238.223.35.bc.googleusercontent.com.https > 33df8a82-1620-4389-bcc8-991291832340.internal.cloudapp.net.58548: Flags [.], ack 1685, win 163, options [nop,nop,TS val 3560064874 ecr 1042351251], length 0
17:06:11.699622 IP 20.207.70.99.https > 33df8a82-1620-4389-bcc8-991291832340.internal.cloudapp.net.49258: Flags [P.], seq 7979:8141, ack 7764, win 19822, options [nop,nop,TS val 1885384920 ecr 1224544801], length 162
17:06:11.699645 IP 33df8a82-1620-4389-bcc8-991291832340.internal.cloudapp.net.49258 > 20.207.70.99.https: Flags [.], ack 8141, win 24275, options [nop,nop,TS val 1224545041 ecr 1885384920], length 0
17:06:11.766698 IP 20.207.70.99.https > 33df8a82-1620-4389-bcc8-991291832340.internal.cloudapp.net.49258: Flags [P.], seq 8141:8399, ack 7764, win 19822, options [nop,nop,TS val 1885384987 ecr 1224545041], length 258
17:06:11.766719 IP 33df8a82-1620-4389-bcc8-991291832340.internal.cloudapp.net.49258 > 20.207.70.99.https: Flags [.], ack 8399, win 24275, options [nop,nop,TS val 1224545109 ecr 1885384987], length 0
17:06:11.768278 IP 33df8a82-1620-4389-bcc8-991291832340.internal.cloudapp.net.49258 > 20.207.70.99.https: Flags [P.], seq 7764:7912, ack 8399, win 24275, options [nop,nop,TS val 1224545110 ecr 1885384987], length 148
17:06:11.768394 IP 33df8a82-1620-4389-bcc8-991291832340.internal.cloudapp.net.49258 > 20.207.70.99.https: Flags [P.], seq 7912:8028, ack 8399, win 24275, options [nop,nop,TS val 1224545110 ecr 1885384987], length 116
17:06:11.769081 IP 20.207.70.99.https > 33df8a82-1620-4389-bcc8-991291832340.internal.cloudapp.net.49258: Flags [.], ack 8028, win 19822, options [nop,nop,TS val 1885384990 ecr 1224545110], length 0
17:06:12.175456 IP 33df8a82-1620-4389-bcc8-991291832340.internal.cloudapp.net.55850 > 20.150.114.101.https: Flags [P.], seq 1512:2016, ack 1180, win 501, options [nop,nop,TS val 3175341986 ecr 1154140588], length 504
17:06:12.178308 IP 20.150.114.101.https > 33df8a82-1620-4389-bcc8-991291832340.internal.cloudapp.net.55850: Flags [P.], seq 1180:1546, ack 2016, win 16382, options [nop,nop,TS val 1154141590 ecr 3175341986], length 366
17:06:12.178308 IP 20.150.114.101.https > 33df8a82-1620-4389-bcc8-991291832340.internal.cloudapp.net.55850: Flags [P.], seq 1546:1573, ack 2016, win 16382, options [nop,nop,TS val 1154141590 ecr 3175341986], length 27
17:06:12.178329 IP 33df8a82-1620-4389-bcc8-991291832340.internal.cloudapp.net.55850 > 20.150.114.101.https: Flags [.], ack 1546, win 501, options [nop,nop,TS val 3175341989 ecr 1154141590], length 0
17:06:12.178336 IP 33df8a82-1620-4389-bcc8-991291832340.internal.cloudapp.net.55850 > 20.150.114.101.https: Flags [.], ack 1573, win 501, options [nop,nop,TS val 3175341989 ecr 1154141590], length 0
17:06:12.258844 IP 33df8a82-1620-4389-bcc8-991291832340.internal.cloudapp.net.57725 > 168.63.129.16.domain: 383+ [1au] A? unleash.codeium.com. (48)
17:06:12.259079 IP 33df8a82-1620-4389-bcc8-991291832340.internal.cloudapp.net.39449 > 168.63.129.16.domain: 21219+ [1au] AAAA? unleash.codeium.com. (48)
17:06:12.259134 IP 33df8a82-1620-4389-bcc8-991291832340.internal.cloudapp.net.59244 > 168.63.129.16.domain: 56595+ [1au] AAAA? unleash.codeium.com. (48)
17:06:12.260364 IP 168.63.129.16.domain > 33df8a82-1620-4389-bcc8-991291832340.internal.cloudapp.net.59244: 56595 0/1/1 (138)
17:06:12.260500 IP 168.63.129.16.domain > 33df8a82-1620-4389-bcc8-991291832340.internal.cloudapp.net.39449: 21219 0/1/1 (138)
17:06:12.260500 IP 168.63.129.16.domain > 33df8a82-1620-4389-bcc8-991291832340.internal.cloudapp.net.57725: 383 1/0/1 A 35.223.238.178 (64)
17:06:12.260663 IP 33df8a82-1620-4389-bcc8-991291832340.internal.cloudapp.net.58556 > 178.238.223.35.bc.googleusercontent.com.https: Flags [S], seq 269650819, win 64240, options [mss 1460,sackOK,TS val 1042352216 ecr 0,nop,wscale 7], length 0
17:06:12.277277 IP 20.207.70.99.https > 33df8a82-1620-4389-bcc8-991291832340.internal.cloudapp.net.49258: Flags [P.], seq 8399:8737, ack 8028, win 19822, options [nop,nop,TS val 1885385498 ecr 1224545110], length 338
17:06:12.280260 IP 33df8a82-1620-4389-bcc8-991291832340.internal.cloudapp.net.49258 > 20.207.70.99.https: Flags [P.], seq 8028:8128, ack 8737, win 24275, options [nop,nop,TS val 1224545622 ecr 1885385498], length 100
17:06:12.280290 IP 33df8a82-1620-4389-bcc8-991291832340.internal.cloudapp.net.49258 > 20.207.70.99.https: Flags [P.], seq 8128:8244, ack 8737, win 24275, options [nop,nop,TS val 1224545622 ecr 1885385498], length 116
17:06:12.281422 IP 20.207.70.99.https > 33df8a82-1620-4389-bcc8-991291832340.internal.cloudapp.net.49258: Flags [.], ack 8244, win 19822, options [nop,nop,TS val 1885385502 ecr 1224545622], length 0
17:06:12.328312 IP 33df8a82-1620-4389-bcc8-991291832340.internal.cloudapp.net.49258 > 20.207.70.99.https: Flags [P.], seq 8244:8506, ack 8737, win 24275, options [nop,nop,TS val 1224545670 ecr 1885385502], length 262
17:06:12.328380 IP 33df8a82-1620-4389-bcc8-991291832340.internal.cloudapp.net.49258 > 20.207.70.99.https: Flags [P.], seq 8506:8884, ack 8737, win 24275, options [nop,nop,TS val 1224545670 ecr 1885385502], length 378
17:06:12.328582 IP 33df8a82-1620-4389-bcc8-991291832340.internal.cloudapp.net.49258 > 20.207.70.99.https: Flags [P.], seq 8884:9000, ack 8737, win 24275, options [nop,nop,TS val 1224545670 ecr 1885385502], length 116
17:06:12.329204 IP 20.207.70.99.https > 33df8a82-1620-4389-bcc8-991291832340.internal.cloudapp.net.49258: Flags [.], ack 8884, win 19822, options [nop,nop,TS val 1885385550 ecr 1224545670], length 0
17:06:12.338585 IP 20.207.70.99.https > 33df8a82-1620-4389-bcc8-991291832340.internal.cloudapp.net.49258: Flags [P.], seq 8737:9091, ack 9000, win 19822, options [nop,nop,TS val 1885385559 ecr 1224545670], length 354
17:06:12.340662 IP 33df8a82-1620-4389-bcc8-991291832340.internal.cloudapp.net.49258 > 20.207.70.99.https: Flags [P.], seq 9000:9116, ack 9091, win 24275, options [nop,nop,TS val 1224545683 ecr 1885385559], length 116
17:06:12.340861 IP 33df8a82-1620-4389-bcc8-991291832340.internal.cloudapp.net.49258 > 20.207.70.99.https: Flags [P.], seq 9116:9232, ack 9091, win 24275, options [nop,nop,TS val 1224545683 ecr 1885385559], length 116
17:06:12.341664 IP 20.207.70.99.https > 33df8a82-1620-4389-bcc8-991291832340.internal.cloudapp.net.49258: Flags [.], ack 9232, win 19822, options [nop,nop,TS val 1885385562 ecr 1224545683], length 0
17:06:12.371982 IP 33df8a82-1620-4389-bcc8-991291832340.internal.cloudapp.net.49258 > 20.207.70.99.https: Flags [P.], seq 9232:9332, ack 9091, win 24275, options [nop,nop,TS val 1224545714 ecr 1885385562], length 100
17:06:12.372013 IP 33df8a82-1620-4389-bcc8-991291832340.internal.cloudapp.net.49258 > 20.207.70.99.https: Flags [P.], seq 9332:9448, ack 9091, win 24275, options [nop,nop,TS val 1224545714 ecr 1885385562], length 116
17:06:12.372852 IP 20.207.70.99.https > 33df8a82-1620-4389-bcc8-991291832340.internal.cloudapp.net.49258: Flags [.], ack 9448, win 19822, options [nop,nop,TS val 1885385594 ecr 1224545714], length 0
17:06:12.482537 IP 178.238.223.35.bc.googleusercontent.com.https > 33df8a82-1620-4389-bcc8-991291832340.internal.cloudapp.net.58556: Flags [S.], seq 1167851429, ack 269650820, win 21120, options [mss 1420,sackOK,TS val 4082008915 ecr 1042352216,nop,wscale 7], length 0
17:06:12.482571 IP 33df8a82-1620-4389-bcc8-991291832340.internal.cloudapp.net.58556 > 178.238.223.35.bc.googleusercontent.com.https: Flags [.], ack 1, win 502, options [nop,nop,TS val 1042352437 ecr 4082008915], length 0
17:06:12.482973 IP 33df8a82-1620-4389-bcc8-991291832340.internal.cloudapp.net.58556 > 178.238.223.35.bc.googleusercontent.com.https: Flags [P.], seq 1:473, ack 1, win 502, options [nop,nop,TS val 1042352438 ecr 4082008915], length 472
17:06:12.654206 IP 33df8a82-1620-4389-bcc8-991291832340.internal.cloudapp.net.49258 > 20.207.70.99.https: Flags [P.], seq 9448:9774, ack 9091, win 24275, options [nop,nop,TS val 1224545996 ecr 1885385594], length 326
17:06:12.654404 IP 33df8a82-1620-4389-bcc8-991291832340.internal.cloudapp.net.49258 > 20.207.70.99.https: Flags [P.], seq 9774:9890, ack 9091, win 24275, options [nop,nop,TS val 1224545996 ecr 1885385594], length 116
17:06:12.655129 IP 20.207.70.99.https > 33df8a82-1620-4389-bcc8-991291832340.internal.cloudapp.net.49258: Flags [.], ack 9890, win 19822, options [nop,nop,TS val 1885385876 ecr 1224545996], length 0
17:06:12.663344 IP 20.207.70.99.https > 33df8a82-1620-4389-bcc8-991291832340.internal.cloudapp.net.49258: Flags [P.], seq 9091:9285, ack 9890, win 19822, options [nop,nop,TS val 1885385884 ecr 1224545996], length 194
17:06:12.705093 IP 178.238.223.35.bc.googleusercontent.com.https > 33df8a82-1620-4389-bcc8-991291832340.internal.cloudapp.net.58556: Flags [.], ack 473, win 163, options [nop,nop,TS val 4082009137 ecr 1042352438], length 0
17:06:12.706651 IP 33df8a82-1620-4389-bcc8-991291832340.internal.cloudapp.net.49258 > 20.207.70.99.https: Flags [.], ack 9285, win 24275, options [nop,nop,TS val 1224546049 ecr 1885385884], length 0
17:06:12.706882 IP 178.238.223.35.bc.googleusercontent.com.https > 33df8a82-1620-4389-bcc8-991291832340.internal.cloudapp.net.58556: Flags [P.], seq 1:2817, ack 473, win 163, options [nop,nop,TS val 4082009139 ecr 1042352438], length 2816
17:06:12.706882 IP 178.238.223.35.bc.googleusercontent.com.https > 33df8a82-1620-4389-bcc8-991291832340.internal.cloudapp.net.58556: Flags [P.], seq 2817:3129, ack 473, win 163, options [nop,nop,TS val 4082009139 ecr 1042352438], length 312
17:06:12.706895 IP 33df8a82-1620-4389-bcc8-991291832340.internal.cloudapp.net.58556 > 178.238.223.35.bc.googleusercontent.com.https: Flags [.], ack 2817, win 496, options [nop,nop,TS val 1042352662 ecr 4082009139], length 0
17:06:12.706900 IP 33df8a82-1620-4389-bcc8-991291832340.internal.cloudapp.net.58556 > 178.238.223.35.bc.googleusercontent.com.https: Flags [.], ack 3129, win 494, options [nop,nop,TS val 1042352662 ecr 4082009139], length 0
17:06:12.708465 IP 33df8a82-1620-4389-bcc8-991291832340.internal.cloudapp.net.58556 > 178.238.223.35.bc.googleusercontent.com.https: Flags [P.], seq 473:983, ack 3129, win 501, options [nop,nop,TS val 1042352663 ecr 4082009139], length 510
17:06:12.720840 IP 33df8a82-1620-4389-bcc8-991291832340.internal.cloudapp.net.49258 > 20.207.70.99.https: Flags [P.], seq 9890:9990, ack 9285, win 24275, options [nop,nop,TS val 1224546063 ecr 1885385884], length 100
17:06:12.720864 IP 33df8a82-1620-4389-bcc8-991291832340.internal.cloudapp.net.49258 > 20.207.70.99.https: Flags [P.], seq 9990:10106, ack 9285, win 24275, options [nop,nop,TS val 1224546063 ecr 1885385884], length 116
17:06:12.721725 IP 20.207.70.99.https > 33df8a82-1620-4389-bcc8-991291832340.internal.cloudapp.net.49258: Flags [.], ack 10106, win 19822, options [nop,nop,TS val 1885385942 ecr 1224546063], length 0
17:06:12.930279 IP 178.238.223.35.bc.googleusercontent.com.https > 33df8a82-1620-4389-bcc8-991291832340.internal.cloudapp.net.58556: Flags [P.], seq 3129:3208, ack 983, win 163, options [nop,nop,TS val 4082009362 ecr 1042352663], length 79
17:06:12.930279 IP 178.238.223.35.bc.googleusercontent.com.https > 33df8a82-1620-4389-bcc8-991291832340.internal.cloudapp.net.58556: Flags [P.], seq 3208:3287, ack 983, win 163, options [nop,nop,TS val 4082009362 ecr 1042352663], length 79
17:06:12.930333 IP 33df8a82-1620-4389-bcc8-991291832340.internal.cloudapp.net.58556 > 178.238.223.35.bc.googleusercontent.com.https: Flags [.], ack 3287, win 501, options [nop,nop,TS val 1042352885 ecr 4082009362], length 0
17:06:12.930931 IP 178.238.223.35.bc.googleusercontent.com.https > 33df8a82-1620-4389-bcc8-991291832340.internal.cloudapp.net.58556: Flags [P.], seq 3287:3535, ack 983, win 163, options [nop,nop,TS val 4082009363 ecr 1042352663], length 248
17:06:12.930945 IP 178.238.223.35.bc.googleusercontent.com.https > 33df8a82-1620-4389-bcc8-991291832340.internal.cloudapp.net.58556: Flags [P.], seq 3535:3559, ack 983, win 163, options [nop,nop,TS val 4082009363 ecr 1042352663], length 24
17:06:12.930961 IP 33df8a82-1620-4389-bcc8-991291832340.internal.cloudapp.net.58556 > 178.238.223.35.bc.googleusercontent.com.https: Flags [.], ack 3559, win 501, options [nop,nop,TS val 1042352886 ecr 4082009363], length 0
17:06:12.931031 IP 178.238.223.35.bc.googleusercontent.com.https > 33df8a82-1620-4389-bcc8-991291832340.internal.cloudapp.net.58556: Flags [F.], seq 3559, ack 983, win 163, options [nop,nop,TS val 4082009363 ecr 1042352663], length 0
17:06:12.931320 IP 33df8a82-1620-4389-bcc8-991291832340.internal.cloudapp.net.58556 > 178.238.223.35.bc.googleusercontent.com.https: Flags [P.], seq 983:1007, ack 3560, win 501, options [nop,nop,TS val 1042352886 ecr 4082009363], length 24
17:06:12.931519 IP 33df8a82-1620-4389-bcc8-991291832340.internal.cloudapp.net.58556 > 178.238.223.35.bc.googleusercontent.com.https: Flags [F.], seq 1007, ack 3560, win 501, options [nop,nop,TS val 1042352886 ecr 4082009363], length 0
17:06:12.991158 IP 33df8a82-1620-4389-bcc8-991291832340.internal.cloudapp.net.46521 > 168.63.129.16.domain: 63304+ [1au] A? mobile.events.data.microsoft.com. (61)
17:06:12.991205 IP 33df8a82-1620-4389-bcc8-991291832340.internal.cloudapp.net.56141 > 168.63.129.16.domain: 61720+ [1au] A? mobile.events.data.microsoft.com. (61)
17:06:12.991316 IP 33df8a82-1620-4389-bcc8-991291832340.internal.cloudapp.net.35033 > 168.63.129.16.domain: 63324+ [1au] AAAA? mobile.events.data.microsoft.com. (61)
17:06:12.991353 IP 33df8a82-1620-4389-bcc8-991291832340.internal.cloudapp.net.45290 > 168.63.129.16.domain: 42124+ [1au] AAAA? mobile.events.data.microsoft.com. (61)
17:06:12.992289 IP 168.63.129.16.domain > 33df8a82-1620-4389-bcc8-991291832340.internal.cloudapp.net.35033: 63324 2/1/1 CNAME mobile.events.data.trafficmanager.net., CNAME onedscolprdcus15.centralus.cloudapp.azure.com. (229)
17:06:12.992463 IP 33df8a82-1620-4389-bcc8-991291832340.internal.cloudapp.net.49724 > 168.63.129.16.domain: 10730+ [1au] AAAA? onedscolprdcus15.centralus.cloudapp.azure.com. (74)
17:06:12.992497 IP 33df8a82-1620-4389-bcc8-991291832340.internal.cloudapp.net.52945 > 168.63.129.16.domain: 46841+ [1au] AAAA? onedscolprdcus15.centralus.cloudapp.azure.com. (74)
17:06:12.992966 IP 168.63.129.16.domain > 33df8a82-1620-4389-bcc8-991291832340.internal.cloudapp.net.46521: 63304 3/0/1 CNAME mobile.events.data.trafficmanager.net., CNAME onedscolprdneu08.northeurope.cloudapp.azure.com., A 20.50.80.213 (186)
17:06:12.992966 IP 168.63.129.16.domain > 33df8a82-1620-4389-bcc8-991291832340.internal.cloudapp.net.56141: 61720 3/0/1 CNAME mobile.events.data.trafficmanager.net., CNAME onedscolprdneu08.northeurope.cloudapp.azure.com., A 20.50.80.213 (186)
17:06:12.993069 IP 168.63.129.16.domain > 33df8a82-1620-4389-bcc8-991291832340.internal.cloudapp.net.45290: 42124 2/1/1 CNAME mobile.events.data.trafficmanager.net., CNAME onedscolprdwus11.westus.cloudapp.azure.com. (225)
17:06:12.993656 IP 168.63.129.16.domain > 33df8a82-1620-4389-bcc8-991291832340.internal.cloudapp.net.52945: 46841 0/1/1 (145)
17:06:12.993851 IP 33df8a82-1620-4389-bcc8-991291832340.internal.cloudapp.net.60802 > 20.50.80.213.https: Flags [S], seq 2395098062, win 64240, options [mss 1460,sackOK,TS val 2083811272 ecr 0,nop,wscale 7], length 0
17:06:12.994083 IP 168.63.129.16.domain > 33df8a82-1620-4389-bcc8-991291832340.internal.cloudapp.net.49724: 10730 0/1/1 (145)
17:06:13.124018 IP 20.50.80.213.https > 33df8a82-1620-4389-bcc8-991291832340.internal.cloudapp.net.60802: Flags [S.], seq 3197302200, ack 2395098063, win 65535, options [mss 1440,nop,wscale 8,sackOK,TS val 2805548519 ecr 2083811272], length 0
17:06:13.124045 IP 33df8a82-1620-4389-bcc8-991291832340.internal.cloudapp.net.60802 > 20.50.80.213.https: Flags [.], ack 1, win 502, options [nop,nop,TS val 2083811402 ecr 2805548519], length 0
17:06:13.124308 IP 33df8a82-1620-4389-bcc8-991291832340.internal.cloudapp.net.60802 > 20.50.80.213.https: Flags [P.], seq 1:486, ack 1, win 502, options [nop,nop,TS val 2083811402 ecr 2805548519], length 485
17:06:13.153289 IP 178.238.223.35.bc.googleusercontent.com.https > 33df8a82-1620-4389-bcc8-991291832340.internal.cloudapp.net.58556: Flags [R], seq 1167854989, win 0, length 0
17:06:13.153289 IP 178.238.223.35.bc.googleusercontent.com.https > 33df8a82-1620-4389-bcc8-991291832340.internal.cloudapp.net.58556: Flags [R], seq 1167854989, win 0, length 0
17:06:13.175470 IP 33df8a82-1620-4389-bcc8-991291832340.internal.cloudapp.net.55850 > 20.150.114.101.https: Flags [P.], seq 2016:2520, ack 1573, win 501, options [nop,nop,TS val 3175342986 ecr 1154141590], length 504
17:06:13.177983 IP 20.150.114.101.https > 33df8a82-1620-4389-bcc8-991291832340.internal.cloudapp.net.55850: Flags [P.], seq 1573:1939, ack 2520, win 16380, options [nop,nop,TS val 1154142590 ecr 3175342986], length 366
17:06:13.177983 IP 20.150.114.101.https > 33df8a82-1620-4389-bcc8-991291832340.internal.cloudapp.net.55850: Flags [P.], seq 1939:1966, ack 2520, win 16380, options [nop,nop,TS val 1154142590 ecr 3175342986], length 27
17:06:13.178009 IP 33df8a82-1620-4389-bcc8-991291832340.internal.cloudapp.net.55850 > 20.150.114.101.https: Flags [.], ack 1939, win 501, options [nop,nop,TS val 3175342989 ecr 1154142590], length 0
17:06:13.178019 IP 33df8a82-1620-4389-bcc8-991291832340.internal.cloudapp.net.55850 > 20.150.114.101.https: Flags [.], ack 1966, win 501, options [nop,nop,TS val 3175342989 ecr 1154142590], length 0
17:06:13.254220 IP 20.50.80.213.https > 33df8a82-1620-4389-bcc8-991291832340.internal.cloudapp.net.60802: Flags [P.], seq 1:100, ack 486, win 16386, options [nop,nop,TS val 2805548650 ecr 2083811402], length 99
17:06:13.254239 IP 33df8a82-1620-4389-bcc8-991291832340.internal.cloudapp.net.60802 > 20.50.80.213.https: Flags [.], ack 100, win 502, options [nop,nop,TS val 2083811532 ecr 2805548650], length 0
17:06:13.255586 IP 33df8a82-1620-4389-bcc8-991291832340.internal.cloudapp.net.60802 > 20.50.80.213.https: Flags [P.], seq 486:1042, ack 100, win 502, options [nop,nop,TS val 2083811533 ecr 2805548650], length 556
17:06:13.257597 IP 33df8a82-1620-4389-bcc8-991291832340.internal.cloudapp.net.49258 > 20.207.70.99.https: Flags [P.], seq 10106:10352, ack 9285, win 24275, options [nop,nop,TS val 1224546599 ecr 1885385942], length 246
17:06:13.257690 IP 33df8a82-1620-4389-bcc8-991291832340.internal.cloudapp.net.49258 > 20.207.70.99.https: Flags [P.], seq 10352:10468, ack 9285, win 24275, options [nop,nop,TS val 1224546600 ecr 1885385942], length 116
17:06:13.258492 IP 20.207.70.99.https > 33df8a82-1620-4389-bcc8-991291832340.internal.cloudapp.net.49258: Flags [.], ack 10468, win 19822, options [nop,nop,TS val 1885386479 ecr 1224546599], length 0
