17:16:13.275305 IP 33df8a82-1620-4389-bcc8-991291832340.internal.cloudapp.net.49258 > 20.207.70.99.https: Flags [P.], seq 2729497665:2729497879, ack 2919478015, win 24275, options [nop,nop,TS val 1225146617 ecr 1885986469], length 214
17:16:13.275350 IP 33df8a82-1620-4389-bcc8-991291832340.internal.cloudapp.net.49258 > 20.207.70.99.https: Flags [P.], seq 214:544, ack 1, win 24275, options [nop,nop,TS val 1225146617 ecr 1885986469], length 330
17:16:13.275472 IP 33df8a82-1620-4389-bcc8-991291832340.internal.cloudapp.net.49258 > 20.207.70.99.https: Flags [P.], seq 544:660, ack 1, win 24275, options [nop,nop,TS val 1225146617 ecr 1885986469], length 116
17:16:13.276254 IP 20.207.70.99.https > 33df8a82-1620-4389-bcc8-991291832340.internal.cloudapp.net.49258: Flags [.], ack 544, win 19822, options [nop,nop,TS val 1885986510 ecr 1225146617], length 0
17:16:13.291142 IP 20.207.70.99.https > 33df8a82-1620-4389-bcc8-991291832340.internal.cloudapp.net.49258: Flags [P.], seq 1:291, ack 660, win 19822, options [nop,nop,TS val 1885986525 ecr 1225146617], length 290
17:16:13.294864 IP 33df8a82-1620-4389-bcc8-991291832340.internal.cloudapp.net.49258 > 20.207.70.99.https: Flags [P.], seq 660:906, ack 291, win 24275, options [nop,nop,TS val 1225146637 ecr 1885986525], length 246
17:16:13.295098 IP 33df8a82-1620-4389-bcc8-991291832340.internal.cloudapp.net.49258 > 20.207.70.99.https: Flags [P.], seq 906:1022, ack 291, win 24275, options [nop,nop,TS val 1225146637 ecr 1885986525], length 116
17:16:13.296047 IP 20.207.70.99.https > 33df8a82-1620-4389-bcc8-991291832340.internal.cloudapp.net.49258: Flags [.], ack 1022, win 19822, options [nop,nop,TS val 1885986530 ecr 1225146637], length 0
17:16:13.300532 IP 33df8a82-1620-4389-bcc8-991291832340.internal.cloudapp.net.49258 > 20.207.70.99.https: Flags [P.], seq 1022:1138, ack 291, win 24275, options [nop,nop,TS val 1225146642 ecr 1885986530], length 116
17:16:13.300801 IP 33df8a82-1620-4389-bcc8-991291832340.internal.cloudapp.net.49258 > 20.207.70.99.https: Flags [P.], seq 1138:1254, ack 291, win 24275, options [nop,nop,TS val 1225146643 ecr 1885986530], length 116
17:16:13.301752 IP 20.207.70.99.https > 33df8a82-1620-4389-bcc8-991291832340.internal.cloudapp.net.49258: Flags [.], ack 1254, win 19822, options [nop,nop,TS val 1885986535 ecr 1225146642], length 0
17:16:13.344453 IP 33df8a82-1620-4389-bcc8-991291832340.internal.cloudapp.net.49258 > 20.207.70.99.https: Flags [P.], seq 1254:1516, ack 291, win 24275, options [nop,nop,TS val 1225146686 ecr 1885986535], length 262
17:16:13.344588 IP 33df8a82-1620-4389-bcc8-991291832340.internal.cloudapp.net.49258 > 20.207.70.99.https: Flags [P.], seq 1516:1632, ack 291, win 24275, options [nop,nop,TS val 1225146686 ecr 1885986535], length 116
17:16:13.345425 IP 20.207.70.99.https > 33df8a82-1620-4389-bcc8-991291832340.internal.cloudapp.net.49258: Flags [.], ack 1632, win 19822, options [nop,nop,TS val 1885986579 ecr 1225146686], length 0
17:16:13.345555 IP 33df8a82-1620-4389-bcc8-991291832340.internal.cloudapp.net.49258 > 20.207.70.99.https: Flags [P.], seq 1632:1894, ack 291, win 24275, options [nop,nop,TS val 1225146687 ecr 1885986579], length 262
17:16:13.345626 IP 33df8a82-1620-4389-bcc8-991291832340.internal.cloudapp.net.49258 > 20.207.70.99.https: Flags [P.], seq 1894:2010, ack 291, win 24275, options [nop,nop,TS val 1225146687 ecr 1885986579], length 116
17:16:13.346331 IP 20.207.70.99.https > 33df8a82-1620-4389-bcc8-991291832340.internal.cloudapp.net.49258: Flags [.], ack 2010, win 19822, options [nop,nop,TS val 1885986580 ecr 1225146687], length 0
17:16:13.354594 IP 20.207.70.99.https > 33df8a82-1620-4389-bcc8-991291832340.internal.cloudapp.net.49258: Flags [P.], seq 291:645, ack 2010, win 19822, options [nop,nop,TS val 1885986588 ecr 1225146687], length 354
17:16:13.356541 IP 33df8a82-1620-4389-bcc8-991291832340.internal.cloudapp.net.49258 > 20.207.70.99.https: Flags [P.], seq 2010:2126, ack 645, win 24275, options [nop,nop,TS val 1225146698 ecr 1885986588], length 116
17:16:13.356716 IP 33df8a82-1620-4389-bcc8-991291832340.internal.cloudapp.net.49258 > 20.207.70.99.https: Flags [P.], seq 2126:2242, ack 645, win 24275, options [nop,nop,TS val 1225146699 ecr 1885986588], length 116
